"id","qid1","qid2","question1","question2","is_duplicate"
0,1,2,"What is the step by step guide to invest in share market in india?","What is the step by step guide to invest in share market?","0"
1,3,4,"What is the story of Kohinoor (Koh-i-Noor) Diamond?","What would happen if the Indian government stole the Kohinoor (Koh-i-Noor) diamond back?","0"
2,5,6,"How can I increase the speed of my internet connection while using a VPN?","How can Internet speed be increased by hacking through DNS?","0"
3,7,8,"Why am I mentally very lonely? How can I solve it?","Find the remainder when [math]23^{24}[/math] is divided by 24,23?","0"
4,9,10,"Which one dissolve in water quikly sugar, salt, methane and carbon di oxide?","Which fish would survive in salt water?","0"
5,11,12,"Astrology: I am a Capricorn Sun Cap moon and cap rising...what does that say about me?","I'm a triple Capricorn (Sun, Moon and ascendant in Capricorn) What does this say about me?","1"
6,13,14,"Should I buy tiago?","What keeps childern active and far from phone and video games?","0"
7,15,16,"How can I be a good geologist?","What should I do to be a great geologist?","1"
8,17,18,"When do you use シ instead of し?","When do you use ""&"" instead of ""and""?","0"
9,19,20,"Motorola (company): Can I hack my Charter Motorolla DCX3400?","How do I hack Motorola DCX3400 for free internet?","0"
10,21,22,"Method to find separation of slits using fresnel biprism?","What are some of the things technicians can tell about the durability and reliability of Laptops and its components?","0"
11,23,24,"How do I read and find my YouTube comments?","How can I see all my Youtube comments?","1"
12,25,26,"What can make Physics easy to learn?","How can you make physics easy to learn?","1"
13,27,28,"What was your first sexual experience like?","What was your first sexual experience?","1"
14,29,30,"What are the laws to change your status from a student visa to a green card in the US, how do they compare to the immigration laws in Canada?","What are the laws to change your status from a student visa to a green card in the US? How do they compare to the immigration laws in Japan?","0"
15,31,32,"What would a Trump presidency mean for current international master’s students on an F1 visa?","How will a Trump presidency affect the students presently in US or planning to study in US?","1"
16,33,34,"What does manipulation mean?","What does manipulation means?","1"
17,35,36,"Why do girls want to be friends with the guy they reject?","How do guys feel after rejecting a girl?","0"
18,37,38,"Why are so many Quora users posting questions that are readily answered on Google?","Why do people ask Quora questions which can be answered easily by Google?","1"
19,39,40,"Which is the best digital marketing institution in banglore?","Which is the best digital marketing institute in Pune?","0"
20,41,42,"Why do rockets look white?","Why are rockets and boosters painted white?","1"
21,43,44,"What's causing someone to be jealous?","What can I do to avoid being jealous of someone?","0"
22,45,46,"What are the questions should not ask on Quora?","Which question should I ask on Quora?","0"
23,47,48,"How much is 30 kV in HP?","Where can I find a conversion chart for CC to horsepower?","0"
24,49,50,"What does it mean that every time I look at the clock the numbers are the same?","How many times a day do a clock’s hands overlap?","0"
25,51,52,"What are some tips on making it through the job interview process at Medicines?","What are some tips on making it through the job interview process at Foundation Medicine?","0"
26,53,54,"What is web application?","What is the web application framework?","0"
27,55,56,"Does society place too much importance on sports?","How do sports contribute to the society?","0"
28,57,58,"What is best way to make money online?","What is best way to ask for money online?","0"
29,59,60,"How should I prepare for CA final law?","How one should know that he/she completely prepare for CA final exam?","1"
30,61,62,"What's one thing you would like to do better?","What's one thing you do despite knowing better?","0"
31,63,64,"What are some special cares for someone with a nose that gets stuffy during the night?","How can I keep my nose from getting stuffy at night?","1"
32,65,66,"What Game of Thrones villain would be the most likely to give you mercy?","What Game of Thrones villain would you most like to be at the mercy of?","1"
33,67,68,"Does the United States government still blacklist (employment, etc.) some United States citizens because their political views?","How is the average speed of gas molecules determined?","0"
34,69,70,"What is the best travel website in spain?","What is the best travel website?","0"
35,71,72,"Why do some people think Obama will try to take their guns away?","Has there been a gun control initiative to take away guns people already own?","0"
36,73,74,"I'm a 19-year-old. How can I improve my skills or what should I do to become an entrepreneur in the next few years?","I am a 19 year old guy. How can I become a billionaire in the next 10 years?","0"
37,75,76,"When a girlfriend asks her boyfriend ""Why did you choose me? What makes you want to be with me?"", what should one reply to her?","My girlfriend said that we should end this because she is confused about her feelings for me. I wished her well and disconnected. Should I call her and ask her if she wants to get back together?","0"
38,77,78,"How do we prepare for UPSC?","How do I prepare for civil service?","1"
39,79,80,"What is the stall speed and AOA of an f-14 with wings fully swept back?","Why did aircraft stop using variable-sweep wings, like those on an F-14?","0"
40,81,82,"Why do Slavs squat?","Will squats make my legs thicker?","0"
41,83,84,"When can I expect my Cognizant confirmation mail?","When can I expect Cognizant confirmation mail?","0"
42,85,86,"Can I make 50,000 a month by day trading?","Can I make 30,000 a month by day trading?","0"
43,87,88,"Is being a good kid and not being a rebel worth it in the long run?","Is being bored good for a kid?","0"
44,89,90,"What universities does Rexnord recruit new grads from? What majors are they looking for?","What universities does B&G Foods recruit new grads from? What majors are they looking for?","0"
45,91,92,"What is the quickest way to increase Instagram followers?","How can we increase our number of Instagram followers?","0"
46,93,94,"How did Darth Vader fought Darth Maul in Star Wars Legends?","Does Quora have a character limit for profile descriptions?","0"
47,95,96,"What are the stages of breaking up between couple? I mean, what happens after the breaking up emotionally whether its a male or female?","Who is affected more by a breakup, the boy or the girl?","0"
48,97,98,"What are some examples of products that can be make from crude oil?","What are some of the products made from crude oil?","1"
49,99,100,"How do I make friends.","How to make friends ?","1"
50,101,102,"Is Career Launcher good for RBI Grade B preparation?","How is career launcher online program for RBI Grade B?","1"
51,103,104,"Will a Blu Ray play on a regular DVD player? If so, how?","How can you play a Blu Ray DVD on a regular DVD player?","1"
52,105,106,"Nd she is always sad?","Aerodynamically what happens when propellor rotates?","0"
53,107,108,"What is the best/most memorable thing you've ever eaten and why?","What is the most delicious dish you've ever eaten and why?","1"
54,109,110,"How GST affects the CAs and tax officers?","Why can't I do my homework?","0"
55,111,112,"How difficult is it get into RSI?","Do you apply for programs like RSI when you're a rising senior?","0"
56,113,114,"Who is israil friend?","Is my boyfriend lying about his true feelings for his friend and is he secretly attracted to her?","0"
57,115,116,"What are some good rap songs to dance to?","What are some of the best rap songs?","0"
58,117,118,"I was suddenly logged off Gmail. I can't remember my Gmail password and just realized the recovery email is no longer alive. What can I do?","I can't remember my Gmail password or my recovery email. How can I recover my e-mail?","1"
59,119,120,"What are the best ways to learn French?","How do I learn french genders?","0"
60,121,122,"How do I download content from a kickass torrent without registration?","Is Kickass Torrents trustworthy?","0"
61,123,124,"Is it normal to have a dark ring around the iris of my eye?","What causes a dark ring around the iris? How should it be treated?","0"
62,125,126,"How is the new Harry Potter book 'Harry Potter and the Cursed Child'?","How bad is the new book by J.K Rowling?","1"
63,127,128,"Why do I always get depressed?","Why do I always get depressed in the evening?","0"
64,129,130,"Where can I find a European family office database?","Where do I find a U.S. family office database?","0"
65,131,132,"What is Java programming? How To Learn Java Programming Language ?","How do I learn a computer language like java?","1"
66,133,134,"What is the best book ever made?","What is the most important book you have ever read?","1"
67,135,136,"Can we ever store energy produced in lightning?","Is it possible to store the energy of lightning?","1"
68,137,138,"What is your review of Performance Testing?","What is performance testing?","0"
69,139,140,"At what cost does so much privacy as in Germany come? What else is lost to gain so much privacy?","Are there any people who genuinely enjoy salad with no dressing?","0"
70,141,142,"What are the types of immunity?","What are the different types of immunity in our body?","0"
71,143,144,"What is a narcissistic personality disorder?","What is narcissistic personality disorder?","1"
72,145,146,"How I can speak English fluently?","How can I learn to speak English fluently?","1"
73,147,148,"How helpful is QuickBooks' auto data recovery support phone number to recover your corrupted data files?","What is the quickbooks customer support phone number USA?","1"
74,149,150,"Who is the richest gambler of all time and how can I reach his level?","Who is the richest gambler of all time and how can I reach his level as a gambler?","1"
75,151,152,"If I fire a bullet backward from an aircraft going faster than the bullet; will the bullet be going backwards?","Do bullets travel faster than the speed of sound when shot from a gun? If not, is it possible? If they do, what gun and how much devastation occurs?","0"
76,153,154,"How do I prevent breast cancer?","Is breast cancer preventable?","0"
77,155,156,"How do I log out of my Gmail account on my friend's phone?","How can I know who logged in to my Gmail account? (by telling his IP address or device name)?","0"
78,157,158,"How can I make money through the Internet?","What are some different ways to make money online, excluding selling things?","0"
79,159,160,"What is purpose of life?","What's the purpose of life? What is life actually about?","1"
80,161,162,"When will the BJP government strip all the Muslims and the Christians of the Indian citizenship and put them on boats like the Rohingya's of Burma?","Why India does not apply the ""Burma-Rohingya model"" to deport illegal Bangladeshis?","0"
81,163,164,"What is the right etiquette for wishing a Jehovah Witness happy birthday?","How important is it to be the first person to wish someone a happy birthday?","0"
82,165,166,"If someone wants to open a commercial FM radio station in any city of India, how much does it cost and what is the procedure?","I want to make a travel commercial/clip video HD , For India and New Zealand. How much will it cost?","0"
83,167,168,"Why do Swiss despise Asians?","Why do technical employees despise sales people so much?","0"
84,169,170,"What are some of the high salary income jobs in the field of biotechnology?","What are some high paying jobs for a fresher with an M.Tech in biotechnology?","1"
85,171,172,"How can I increase my height after 21 also?","Can height increase after 25?","1"
86,173,174,"What were the major effects of the cambodia earthquake, and how do these effects compare to the Kamchatca earthquakes in 1952?","What were the major effects of the cambodia earthquake, and how do these effects compare to the Valparaiso earthquake in 1822?","1"
87,175,176,"What is the difference between sincerity and fairness?","What's the difference between honest and sincere?","0"
88,177,178,"Which is the best gaming laptop under 60k INR?","Which is the best gaming laptop under Rs 60000?","1"
89,179,180,"What is your review of The Next Warrior: Proving Grounds - Part 9?","What is your review of The Next Warrior: Proving Grounds - Part 5?","0"
90,181,182,"What is the best reference book for physics class 11th?","Which book should I choose for reference for physics and chemistry (class 11, CBSE board)?","0"
91,183,184,"National Institute of Technology, Kurukshetra: How is the social life at NITK, Surathkal?","National Institute of Technology Karnataka (NITK) , Surathkal: To the graduating batch: What lessons would you want to give to your juniors before you leave?","0"
92,185,186,"What are some of the best romantic movies in English?","What is the best romantic movie you have ever seen?","1"
93,187,188,"What causes a nightmare?","What causes nightmares that seem real?","1"
94,189,190,"What is abstract expressionism in painting?","What are some of the major influences of abstract expressionism?","0"
95,191,192,"How does 3D printing work?","How do 3D printing work?","1"
96,193,194,"What was it like to attend Caltech with Jeremy Ehrhardt?","Who are some notable folks who attended Caltech?","0"
97,195,196,"Why did harry become a horcrux?","What is a Horcrux?","0"
98,197,198,"What are the best associate product manager (APM) programs that someone in their early 20s can join to learn product management and have a rewarding career in the company?","What are the general requirement to become a Product Manager or a Program Manager in a product based software company?","0"
99,199,200,"Why is the number for Skype at 1-855-425-3768 always busy?","How could I get Skype to work on an android 4.1.1 phone?","0"
100,201,202,"Will there really be any war between India and Pakistan over the Uri attack? What will be its effects?","Will there be a nuclear war between India and Pakistan?","1"
101,203,204,"Did Ronald Reagan have a mannerism in his speech?","How did Ronald Reagan react to 9/11?","0"
102,205,206,"What were the war strategies of the Union and the Confederates during the Civil War?","How could the Confederates have possibly defeated Union forces at Gettysburg during the American Civil War?","0"
103,207,208,"Which is the best fiction novel of 2016?","Which are some of the best fiction novels?","0"
104,209,210,"Can I recover my email if I forgot the password?","What should I do if I forgot my email password?","1"
105,211,212,"Will the recent demonetisation results in higher GDP? If so how much?","How demonetisation could affect the GDP of India in both short run and long run?","0"
106,213,214,"Have you ever heard of travel hacking?","Can WhatsApp be hacked?","0"
107,215,216,"What's the difference between love and pity?","What is the difference between love and pity?","1"
108,217,218,"How competitive is the hiring process at Republic Bank?","How competitive is the hiring process at S & T Bank?","0"
109,219,220,"How Google helps in spam ranking adjustment of the search results?","What is the distribution of traffic between Google organic search results? e.g. #1 vs. #2 in rankings, first page vs. second page","0"
110,221,222,"Where can I watch gonulcelen with english subtitles?","Where can I watch sarrainodu with subtitles?","0"
111,223,224,"Is USA the most powerful country of the world?","Why is the USA the most powerful country of the world?","0"
112,225,226,"How do you obtain an instant ulcer pain relief?","What is better for a low back pain: heat or ice?","0"
113,227,228,"What do you think China food?","How do you think of Chinese food?","1"
114,229,230,"What does taking advantage of someone mean?","Is it worse to take advantage of someone or be materialistic?","0"
115,231,232,"Why do we cry when we are happy and when we are sad?","Why do we cry?","0"
116,233,234,"Why do some girls like to stick their their tongues out when taking pictures?","Why do teen girls (and women in general) allow their boyfriends to take naked pictures of them in this day and (digital) age?","0"
117,235,236,"Did you find the ending of the novel ""1984"" depressing?","How do Winston and Julia differ in the novel ""1984""? How are they similar?","0"
118,237,238,"What are some mind-blowing computer tools that exist that most people don't know about?","What are some mind-blowing technologies that exist that most people don't know about?","0"
119,239,240,"Should the toothbrush be wet or dry before applying the toothpaste?","What is the cheapest toothpaste?","0"
120,241,242,"Why my question was marked as needing imrovement?","How can I ask a question without getting marked as ‘need to improve’?","1"
121,243,244,"What is the difference between a neutral state and a buffer state?","If every state of the USA declared war against each other, which would win?","0"
122,245,246,"What mineral holds the highest electrical charge?","What mineral can hold the greatest electrical charge?","1"
123,247,248,"What is the greatest mystery in the universe?","What is the greatest mystery of all time?","0"
124,249,250,"What is the alternative to machine learning?","How do I over-sample a multi-class imbalance data set?","0"
125,251,252,"Why does China block sanctions at the UN against the Jaish-e-Mohammad (JeM) chief, Masood Azhar?","Why does China support Masood Azhar?","1"
126,253,254,"What is the mean of future budget?","What is the meaning of the future?","0"
127,255,256,"Can excessive amounts of Vitamin C cause me to have a miscarriage?","How can Vitamin C cause a miscarriage?","1"
128,257,258,"What is it like to work in Asahi India Glass? What will be the pay scale after one or two years?","When will we get the Call Letter after we get the Letter of Intent in Asahi India Glass recruitment?","0"
129,259,260,"How do I access Torbox in India?","How do I access Google.com from India?","0"
130,261,262,"What are some yakshini mantras?","What is a Yantra & Mantra?","0"
131,263,264,"Was six party talks successful?","Which course is better in NICMAR?","0"
132,265,266,"How do I register my domain site email?","How do you register a .an domain?","0"
133,267,268,"Is it normal for older men to be attracted to young women?","Why am I attracted to older men?","0"
134,269,270,"What is the strongest structure or strongest shape under compression?","What is the strongest Kevlar cord?","0"
135,271,272,"Who are the Rohingya Muslims?","Who are the Rohingya people?","1"
136,273,274,"Does it matter whether humans are selfish or evil?","Does it matter whether humanity is evil or not?","1"
137,275,276,"Are exocytosis and endocytosis examples of active or passive transport?","What are examples of passive transport in cells?","0"
138,277,278,"How i get hair on bald head?","If I shave my head for 2 years as am getting bald and then grew my hair, will the hair will be same as when I intially have? Or I loose more hair?","0"
139,279,280,"What is the ideal life after retirement?","What's life after retirement?","0"
140,281,282,"What is our stance against Pakistan?","What is the stance of Pakistan in the possession of weapons of mass destruction by North korea? Does it support DPRK or is it against DPRK?","0"
141,283,284,"What are good websites for escorts?","How do I find a good escort?","0"
142,285,286,"Which one is better polo diesel or grand i10 petrol?","What is the best diet for a growing decathlete?","0"
143,287,288,"Does a black hole have mass?","Does a black hole have a finite mass?","1"
144,289,290,"Is Morgan Freeman correct when he says the only way to stop racism, is to stop talking about it?","What are your views about this Morgan Freeman quote about Racism?","1"
145,291,292,"Does Fab currently offer new employees stock options or RSUs?","Does Uber currently offer new employees stock options or RSUs?","0"
146,293,294,"How would you review the site Waveclues?","Is there a good pay for reviews site out there?","0"
147,295,296,"In how many ways can we distribute 10 identical looking pencils to 4 students so that each student gets at least one pencil?","In how many ways 12 apples can be distributed among 4 children such that every child gets at least 2 apples?","0"
148,297,298,"How much would it cost to hire Jerry Seinfeld for 1-2 hours?","How much on average would it cost to video tape a 2 hour presentation?","0"
149,299,300,"Is 7 days too late for rabies vaccine after a possible non-bite exposure?","Can I take rabies injection after 1 day of dog bite?","0"
150,301,302,"How many years Britain ruled India?","What is the standard amount of time off given for an international relocation?","0"
151,303,304,"How can I stop being afraid of working?","How do you stop being afraid of everything?","0"
152,305,306,"Why does Red keep the keys in OITNB?","Why does Red keep the keys in season 4 of Orange is the New Black?","1"
153,307,308,"At what age should someone lose their virginity?","At what age, how, and where did you lose your virginity?","0"
154,309,310,"How forgetful are you?","How can I forget my wife?","0"
155,311,312,"Could Snoke secretly be Darth Maul?","How could snoke be darth plagueis if he was killed by the emperor?","0"
156,313,314,"If I do not monetize YouTube videos & upload copyright content, then are there chances that Google may block my account?","How do you upload movies on YouTube and monetize them? Is there any issue of copyright","1"
157,315,316,"Would you switch from Canon 6D to Leica D-LUX 109?","What tripod should I get for my Canon 6D?","0"
158,317,318,"What does the Quora website look like to members of Quora moderation?","How does Quora look to a moderator?","1"
159,319,320,"Why nobody answer my questions in Quora?","Why is no one answering my questions in Quora?","1"
160,321,322,"What is the funniest joke you know?","What is the funniest joke of all time?","1"
161,323,324,"I got job offer @ Chelmsford-Essex, London with £3764 PM pay-after tax deduction. Pls advice tentative monthly expenses for couple? & saving possible?","If I am leaving Norway, can I pay down my mortgage with my BSU account, and then sell my apartment without having to pay back the tax deduction I got for having BSU?","0"
162,325,326,"What are stereotypes about the United Kingdom?","What do Americans think about the United Kingdom?","0"
163,327,328,"How do I use Twitter as a business source?","How can I use Twitter for business?","1"
164,329,330,"How can I transfer money from Skrill to a PayPal account?","How can I send money from my PayPal account to my Skrill account to withdraw?","0"
165,331,332,"Which is the best earphone with deep bass under 1000?","Which is the Best earphones under Rs 1000?","1"
166,333,334,"Are government employees eligible to Sukanya Samrudi Yojana?","Can a Government employee apply IEC?","0"
167,335,336,"Which is correct - 'Looking forward to speak with you' or 'Look forward to speak with you'?","Which is correct: ""speak with"" or ""speak to""?","0"
168,337,338,"Which are the best engineering fields?","What is the best field of engineering?","1"
169,339,340,"How do you make life suit you and stop life from abusing you mentally and emotionally?","Why are emotionally abusive people in my life? Several ex boyfriends, friends, and past coworkers/bosses have been abusers. Do I attract them?","0"
170,341,342,"What is the difference between gross salary and CTC?","There seems to be a difference between my weekly paycheck and the yearly salary my employer agreed upon, how does that work?","0"
171,343,344,"Which are the prospering towns in Kerala?","Why are there so many Christians in Kerala?","0"
172,345,346,"What is the best way to gain confidence?","How can I speak with more clarity and confidence?","0"
173,347,348,"Does anyone see the relation between Greek gods and Hindu gods?","What parallelism can we draw between gods of Hindu mythology, Greek mythology, Egyptian mythology, etc.?","1"
174,349,350,"How do I switch from Apple Music to Spotify?","Should I switch from Spotify to Apple Music?","0"
175,351,352,"Which is the best fixed income fund?","What is the best fixed income fund?","1"
176,353,354,"What is it like to live in Cologne?","What is it like to live in Köln, Germany? ","1"
177,355,356,"Between Robert De Niro and Al Pacino, who is more successful?","Who do you regard as the best actor, Robert De Niro or Al Pacino?","0"
178,357,358,"Why does some people prefer small families.?","Why do some people prefer to live with small family?","1"
179,359,360,"Do animals kiss?","Do animals (besides humans) kiss?","1"
180,361,362,"How do you get deleted Instagram chats?","How can I view deleted Instagram dms?","1"
181,363,364,"How can I stop being addicted to love?","How do I stop being addicted to someone?","0"
182,365,366,"What if I hired two private eyes and ordered them to follow each other?","Would I be able to hire two private investigators and then get them to follow each other?","1"
183,367,368,"How do I find a startup accelerator?","How do startup accelerators give you the funding?","0"
184,369,370,"How can I check wifi history and access it through android phones?","I cannot open Quora through my WiFi router. Why can I only access it through a mobile network?","0"
185,371,372,"What was the significance of the battle of Somme, and how did this battle compare and contrast to the Battle of Rostov?","What was the significance of the battle of Somme, and how did this battle compare and contrast to the Battle of Riyadh?","1"
186,373,374,"What is the most creative college admissions essay you've read?","Has any college admission officer cried in public while reading an applicant's essay?","0"
