"id","qid1","qid2","question1","question2","is_duplicate"
747,1495,1496,"What is the opera song with a choir used for horror movies?","What are an opera choir's rights? Do we get paid for rehearsals? Are we entitled to catering throughout rehearsals, etc. (part of an opera company)?","0"
748,1497,1498,"Would a woman in the Catholic Church be shunned or ostracized for having a sexual relationship with a priest?","What would happen if a woman sued the Catholic Church for not allowing them to become a priest?","0"
749,1499,1500,"If a Canadian gets a tattoo in America, do they have to declare the cost when returning to Canada?","I'm a Canadian PR that just finished studying in the US. I got offered an H1-B. Should I take the offer or return to Canada?","0"
750,1501,1502,"How can I see who blocked me at Facebook?","Will I see if someone blocked me of Facebook?","1"
751,1503,1504,"Why has there been a scarcity of high quality fantasy films?","Briefly describe how you would test a mineral for each of these properties?","0"
752,1505,1506,"Who are some of great coders from Tamil Nadu?","Are there any competitive coders from Tamil Nadu?","1"
753,1507,1508,"What do think of when you hear the word elect?","What do you think when you hear the word, ""Japan""?","0"
754,1509,1510,"Which is the best programming language to learn in 2017?","How should you start learning programming?","0"
755,1511,1512,"What is the ultimate way to serve humanity?","How can one serve humanity?","1"
756,1513,1514,"How can I calculate 72 hours from now?","How do I calculate a semester percentage from SGPA in ITER?","0"
757,1515,1516,"How hard was it for Jimmy Wales to immigrate to the UK?","Why does Jimmy Wales choose to reside in London instead of the US?","0"
758,1517,1518,"Cochin to London etihad is the change over time of 1hr sufficient in Dubai?","What is difference between China and the United States to send gifts?","0"
759,1519,1520,"What is Quora's algorithm for sorting answers to a single question?","How does the ranking of answers on Quora work?","0"
760,1521,1522,"What will be the resolution one should have for the year 2016?","What's your resolution for year 2016?","1"
761,1523,1524,"What are Balaji Viswanathan's views on caste based reservations in India?","What is Balaji Vishwanathan's view on caste based reservation system in India?","1"
762,1525,1526,"Jawed habib haircut prices?","DO YOU THINK IF MY TREE FALLS ON YOUR PROPERTY IT SHOULD BE MYINE OR YOUR RESPONSABILITY?","0"
763,1527,1528,"Does any one have ebook of answers of wren and Martin grammer and composition?","Why did barvaria join Germany?","0"
764,1529,1530,"What is [math]x[/math] if [math]x+\left(\dfrac{1}{x}\right) =0[/math]?","What is [math]\mathop {\lim}\limits_{x \to 0^+}\frac{1}{x}^\frac{-x}{x+1}[/math]?","0"
765,1531,1532,"Whenever its about “her” its a very special feeling. Tried hard to forget her but she's alwys spcl. Should I stop talking to her even as a friend ?","How should I stop thinking about someone?","0"
766,1533,1534,"What are Mutual funds? How do they work?","What is mutual fund all about?","1"
767,1535,1536,"How has the vertebral column anatomy changed through time?","When calculating bullet spin; MV X 12 (twist rate in inches) X 60=RPM, does distance to target matter?","0"
768,1537,1538,"Which acoustic bass guitar is the best?","How do you go about maintaining an acoustic bass guitar?","0"
769,1539,1540,"Which universities in the US offer more management content in the management information systems curriculum?","Which universities in the US offer a more technical content in the management information systems curriculum?","0"
770,1541,1542,"My maths have become extremely weak and I am in class 12th. How can I improve my maths so that I can clear my JEE exams next year?","I want to do a BBA. I only got 62% in class 12 (non maths). I am taking 1 year drop for the entrance exam of Symbiosis, GGSIPU, etc. Should I also give an improvement next year?","0"
771,1543,1544,"What is a ""function"" in the context of functional programming?","What is functional programming?","0"
772,1545,1546,"What is the main difference between socialism and communism.?","What is the difference between socialism, marxism, and communism?","1"
773,1547,1548,"How do I change my Facebook password?","How can I log in Facebook without password?","1"
774,1549,1550,"How is the word 'valiant' used in a sentence?","How is the word 'contorted' used in a sentence?","0"
775,1551,1552,"Why I feel dizzy when I am playing some 3D games but others do not make me feel like this? Are there any tricks in developing 3D games to avoid this?","3D Rad: How can I make a mission-based game?","0"
776,1553,1554,"How do payroll companies make money?","How companies make money?","0"
777,1555,1556,"What are the most underrated and overrated movies you've seen?","What are the most overrated movies?","0"
778,1557,1558,"For what use cases do you think deep learning and neural networks overkill and simpler models work better in practice?","In deep Q learning, how we update the weight in neural network?","0"
779,1559,1560,"Which one to learn, C++ or C#?","Which should I learn first: C++ or C#?","1"
780,1561,1562,"Will a Fitbit accurately track my activity if I am riding a bike?","What is the most accurate wearable item for activity  on the market today (i.e. Jawbone or Fitbit)?","0"
781,1563,1564,"What is the best evidence for a historical Jesus?","What is the evidence for and against the existence of the historical Jesus?","1"
782,1565,1566,"Which free online language classes would allow me to go from 0 to fluent in Portuguese given their provided courses of study?","Suggest me some free online courses that provides certificates?","0"
783,1567,1568,"How do the PM and Prez get women?","I worked for 1month and absconded from accenture within bond period will they take any legal action?will it effect when joining other company?","0"
784,1569,1570,"What are some of the best part-time jobs where you can work from home and make some good cash?","What are some of the best paid part time jobs that can be done from home?","1"
785,1571,1572,"Does Trump have a chance at winning presidency?","Is there a big chance that Trump will win the election?","1"
786,1573,1574,"What if I shift my job from e-commerce to cloud computing?","What computer science courses should I take If I want to join a product based or e-commerce company?","0"
787,1575,1576,"How can I meet Suresh Raina?","How do i meet suresh raina?","1"
788,1577,1578,"What is the name of the song in which picturized on Madhuri Dixit and Ranbir Kapoor and is from which movie?","What is the name of the song in which Salman Khan teases Madhuri Dixit by using a slingshot and is from which movie?","0"
789,1579,1580,"What is the function of nucleoplasm in a plant cell?","What is the function of centrosomes in plant cells?","0"
790,1581,1582,"Can fossil records be used as evidence for evolution? If so, how?","What are some examples of evidence of evolution that fossil records provide?","1"
791,1583,1584,"What is the Hizmet movement?","What is the Gülen movement?","1"
792,1585,1586,"Could CAT exam and MAT exam take place on same day (4th December 2016)?","Is it necessary to learn vedic maths and spending time on short tricks for cat 2016 exam?","0"
793,1587,1588,"What mythical creatures are in the Bible?","What do mythical creatures eat?","0"
794,1589,1590,"Which one is good: oral, anal, or vaginal sex?","We had consensual sex, then he forced me into having anal sex. If I press charges, will the fact that I consented to sex vaginally ruin my case?","0"
795,1591,1592,"What are the winter weather conditions like in Cincinnati, OH?","What is the weather like during winter in Tel Aviv?","0"
796,1593,1594,"What stocks are the best to invest in right now?","What are the best stocks to invest for long term right now?","1"
797,1595,1596,"How do we improve reading skills of children?","How do I improve my reading skill?","0"
798,1597,1598,"What should I do if someone has posted a porn video under my name?","What should I do if someone has posted porn video under my name?","1"
799,1599,1600,"Do you lose nutrients & calories when you have diarrhea?","Will eating 2,000 calories a day make me lose weight?","0"
800,1601,1602,"What are the safety precautions on handling shotguns proposed by the NRA in Alaska?","What are the safety precautions on handling shotguns proposed by the NRA in Arizona?","1"
801,1603,1604,"What is the benefit of going Walking every morning?","Bollywood industry doesn't encourage outsiders? For ex outsiders may get one or at max two chances whereas star kids get multiple chances to perform?","0"
802,1605,1606,"Are there any martial artists who started later in life and went on to become champions?","What are the pros and cons of bringing a small claims case before the People's Court on TV?","0"
803,1607,1608,"How do I get my ex back?","How do I ask my ex to get back together?","1"
804,1609,1610,"Which framework should i choose for cross-platform mobile development?","What cross-platform should I choose while developing a mobile application for an enterprise?","0"
805,1611,1612,"What is the best way to prepare to IELTS?","What is the best way to prepare for IELTS?","1"
806,1613,1614,"How do I know if the girl am dating online truly live me for real?","How do I know if my online girlfriend truly loves me?","1"
807,1615,1616,"What area of games programming is most mathematically involved and suited to a math major?","If one was to go about learning Python to be able to apply it to his area of study (Major in Chem minor in Math), what applications of Python could be most useful when applying for a job?","0"
808,1617,1618,"What are the differences between larceny and robbery?","What is the difference between the words burglary and robbery?","0"
809,1619,1620,"Is graph theory counted as a prerequisite for machine learning?","Is Graph Theory a nice-to-have course to have for machine learning?","0"
810,1621,1622,"What are the best schools to study Natural language Processing in India?","Which are the best schools for studying natural language processing?","0"
811,1623,1624,"Will Ted Cruz supporters vote for Donald Trump?","Will Donald Trump support Ted Cruz for president?","0"
812,1625,1626,"What is a GDP?","What is the significance of GDP?","1"
813,1627,1628,"Is there a ""blind trust"" provision for American Presidents, and how is it enforced?","Who will be the new American president? Why","0"
814,1629,1630,"How do I make a girl who is a newly joined junior in my college to fall in love with me?","What do you have to do to become an airline pilot?","0"
815,1631,1632,"What are the home remedies for piles or anal fissure?","How do I cure anal fissure permanently with home remedies?","1"
816,1633,1634,"How many words are actually needed to learn for the GRE and what is the correct method to prepare for the GRE verbal? ?","How can I get best score in GRE?","0"
817,1635,1636,"Is the soul immortal?","Why is the soul immortal?","1"
818,1637,1638,"What are some of your own personal Moon in the 3rd House stories and experiences?","What are some of your own personal Jupiter in the 1st house stories and experiences?","0"
819,1639,1640,"What can be done to reduce the pollution of India?","What is the best way to reduce pollution in india?","1"
820,1641,1642,"Is government liasioning legal in India?","Is UberMoto legal in India?","0"
821,1643,1644,"What's the meaning of ""I gotta take a shit!""?","What does ""I fancy you"" mean?","0"
822,1645,1646,"What is the best place to celebrate New Year 2017 in Hyderabad?","Which is the best place to celebrate New Year 2015 in Hyderabad?","0"
823,1647,1648,"What is working hard (not in terms of studying)?","What is working hard in terms of studying?","0"
824,1649,1650,"Can I upgrade Windows 32 bit to 64 bit Windows 8.1?","I have Windows 7 32 bit. Can I upgrade to 64 bit Windows 10 (since it's a free upgrade)?","0"
825,1651,1652,"Which were some of the bad experiences you had in life?","What were some of your good and bad life experiences?","1"
826,1653,1654,"Why is Timbaland famous?","Which brand of drums does Timbaland use?","0"
827,1655,1656,"Can you get a list of individual telephone numbers?","How do you get cell phone numbers?","1"
828,1657,1658,"Do you have to wake up during REM sleep to remember your dreams?","Do you need to wake up in the middle of REM sleep in order to remember you dreams?","1"
829,1659,1660,"What are common required and elective courses in agriculture?","What are common required and elective courses in philosophy?","0"
830,1661,1662,"How do I learn how to sing?","I want to learn singing. How do I start?","1"
831,1663,1664,"Who is capable of ending Google's monopoly in search?","Will Google's virtual monopoly in web search ever end? When?","0"
832,1665,1666,"Can an auto immune disease cause insomnia?","What causes Auto Immune diseases?","0"
833,1667,1668,"Does GTA IV work in Windows 7?","Does GTA IV work on Windows 10?","0"
834,1669,1670,"Which is the best SSC and banking training insititute in Chandigarh?","Which institute provide best SSC and banking coaching in Chandigarh?","1"
835,1671,1672,"Which is the best PMP Certification course provider in Bangalore?","Which is the best pmp certification center in Bangalore?","1"
836,1673,1674,"What is difference between net and gross income?","What is the difference between gross income versus net income?","1"
837,1675,1676,"How can I wake up early in the morning?","How can I get up early in the morning?","1"
838,1677,1678,"Why do you love her?","What do you love? Why?","0"
839,1679,1680,"I missed the IIT. What should I do?","When should I expect my joining date for Accenture, The timeline shows its 24 dec 2016 and I havent recieved any updates from the Organisation?","0"
840,1681,1682,"What is the difference between the iPhone 6s and iPhone 6s Plus?","What's the difference between the iPhone 6 and the iPhone 6s?","1"
841,1683,1684,"How can one improve a credit score by 100 points?","Which army would win if fights occured between US troops from WW2 and US troops from Vietnam war?","0"
842,1685,1686,"My crush likes me back; what do we do now?","My sister told my crush that I like her without me asking her to do so. What should I do now?","0"
843,1687,1688,"Who is the most powerful character in Skyrim apart from Alduin?","Who would win the Dovahkiin from Skyrim or Kylo ren?","0"
844,1689,1690,"Can a Muslim guy date a non Muslim girl? Is it based on how religious the individual is or are there other factors to it?","What do non-Muslims expect from Muslims?","0"
845,1691,1692,"What are your comments on this picture?","What can I comment to my girlfriend's pictures?","0"
846,1693,1694,"When are the roads most slippery during rain?","During rain what should I do for precautions of flooding road?","0"
847,1695,1696,"How do you prove the Heisenberg uncertainty principle experimentally?","What's the easiest way to prove the Heisenberg uncertainty principle?","0"
848,1697,1698,"What is the IELTS all about?","What is IELTS and its use?","1"
849,1699,1700,"How do I lose weight without doing any sport?","How do I lose weight without doing exercise or diet?","1"
850,1701,1702,"Why do digital cameras have shutter sound?","What digital cameras have electronic shutter that can be set to make absolutely no sound or noise?","1"
851,1703,1704,"What's it like dating a gangster?","I'm 51 can I date a man in his 30's?","0"
852,1705,1706,"What were the main and most important political causes of World War 1?","What were the causes for World War 1?","1"
853,1707,1708,"How do I get over the fear of everything?","How do I get over my fears?","0"
854,1709,1710,"Which city in India has the best weather?","Which city in Argentina has the best weather?","0"
855,1711,1712,"What is the difference between HDD and SSD in layman's terms?","What is differences between SSD and hdd?","1"
856,1713,1714,"What does it mean if a dog vomits white foam?","Why is my puppy vomiting white foam?","1"
857,1715,1716,"Does my life hold any significance to the world/universe?","Do we truly have any purpose in life? Or do we create a purpose to make ourselves feel significant in the very vast world, or to make ourselves feel that our existence in the vast world is required?","0"
858,1717,1718,"How is the job situation in New Zealand for computer science graduates?","How is the job situation in New Zealand for computer science graduates diploma?","1"
859,1719,1720,"How would I develop an e-commerce website?","How do I create an e-commerce website?","1"
860,1721,1722,"How do you get a micro SIM card out of an iPhone 4?","Does an iPhone 4 use a micro SIM card?","0"
861,1723,1724,"What can I do to improve my question on Quora?","All my questions on Quora need improvement. What is the best way to ask a question on Quora?","1"
862,1725,1726,"If one of the people catches feelings, in an established friends with benefits arrangement, how can we drop the feelings going forward?","In an age where we constantly see the best of other people's work and lives, how do we not feel dissatisfied with our own work and lives?","0"
863,1727,1728,"What are some tips for someone trying to teach themselves to sing?","How can I teach myself how to sing?","1"
864,1729,1730,"If climate change scientists are right, why do they worry so much about public relations and packaging?","What kinds of rude comments will a man get in the United States if he dates a woman 30 years younger than him?","0"
865,1731,1732,"What is the main reason for all the problems in India?","If Frances Farmer (the actress) was still around today, what would she think about Donald Trump?","0"
866,1733,1734,"What is a good substitute for milk in macaroni and cheese?","What are some good cheese substitutes for Havarti cheese?","0"
867,1735,1736,"How can constipation cause dizziness?","Can constipation cause dizziness?","0"
868,1737,1738,"Is it possible to make doctor's review app using which patients can share anonymously all treatment given by that doctor, suggested medicines,?","What is the warranty period of the Mi In-Ear Headphones Pro?","0"
869,1739,1740,"What are some of the pros and cons of a Hillary Clinton presidency?","What are pros and cons of Hillary Clinton?","1"
870,1741,1742,"What are the best films that take place in one room?","I want to get thrilled. Which movie should I watch?","0"
871,1743,1744,"Is it normal if your sperm doesn't shoot out during ejaculation?","How do I ensure that semen doesn't come out from my penis after I ejaculate?","0"
872,1745,1746,"Which is the best coaching center for SSC and Banking in Chandigarh?","Which are the best SSC and banking coaching centers in Chandigarh?","1"
873,1747,1748,"What's the next number in the series 1,1,1,2,2,2,6,6,6?","What would be the next number in the series-2,15,4,12,6,7? ...?","0"
874,1749,1750,"What are the best things to do on Halloween?","What do we need to have the best Halloween?","1"
875,1751,1752,"I wish to start investing in Equity and Mutual Funds. Where should I open Demat account for best rates, transaction charges and so on? I am NRI.","I am 17 and I want to invest money in stock market where should I start?","0"
876,1753,1754,"Why do companies issue bonus shares?","Why do company issue bonus shares?","1"
877,1755,1756,"How can changing 500 and 1000 rupee notes end the black money in India?","Do you think scrapping of 500 and 1000 rupee denominations is going to eradicate corruption?","1"
878,1757,1758,"What should I major in (College) that won't leave me unemployed (other than Engineering, Law, Medicine)?","What should I do in a Group discussion when others keep fighting and won't let me talk even after I ask them to let me?","0"
879,1759,1760,"Who are the best custom kiosk manufacturers in India?","Who is the best manufacturer of customized kiosk in India?","0"
880,1761,1762,"Are there any telescopes powerful enough to view evidence left behind from NASA's moon landings?","Do we have telescopes powerful enough nowadays to see the man-made objects left on the moon by the Apollo missions, proving 100% that humans did in fact land there?","1"
881,1763,1764,"Is there any architectural complex/center/forum/hub anywhere in the world? As a third space.","Is there any online software available for calculating the time and space complexity of a Java program in Big O?","0"
882,1765,1766,"How many keywords are there in AutoHotkey Scripting Programming Language in the latest version?","How many keywords are there in AutoIt script programming language in the latest version?","0"
883,1767,1768,"What is the hardest thing(s) about raising children in Ukraine?","What is the hardest thing(s) about raising children in Mexico?","0"
884,1769,1770,"What is the best source to learn stock market online?","What is the best presentation software for you tube video making (both paid and free)?","0"
885,1771,1772,"Why does India sabotage and badmouth all economic projects which its neighbouring counries have in the world?","Why does India always sabotage and badmouth all economic projects Pakistan have with other countries in the world?","0"
886,1773,1774,"What does a wet vagina feel like for a man?","Why does it feel like there is a ball in my vagina?","0"
887,1775,1776,"Will Thursday Night Football increase ratings for CBS on Thursday nights rather than the Big Bang Theory?","Why is The Big Bang Theory (TV series) so popular? Why is it so popular with mainstream viewers?","0"
888,1777,1778,"How can I grow taller at 17?","How can you increase your height?","0"
889,1779,1780,"Have you ever been fired?","Have you ever been fired? How did you deal with it?","1"
890,1781,1782,"How on earth would I dress like a workout guy from the year 1990 in the summer?","How would I dress like a workout guru from the year 1990 in the summer?","1"
891,1783,1784,"My girlfriend has stopped talking to me. What should I do?","My girlfriend is not talking to me. What should I do?","1"
892,1785,1786,"What will the real estate look like now after the 500 and 1000 scraping?","How will abolishing Rs. 500 and Rs. 1000 notes affect the real estate businesses in India?","1"
893,1787,1788,"What are the best interview questions ever asked?","What are the best interview questions to ask?","1"
894,1789,1790,"I trust people very quickly and as a result always have been betrayed? What do I do not to trust people and still hold the relation simple?","Do you think trusting other people is wise enough after being betrayed by someone else?","0"
895,1791,1792,"Who are the best headhunters in Mumbai?","Who are the best headhunters?","0"
896,1793,1794,"What is the DHP vaccine for dogs for? Is it necessary?","Can rabies vaccine for humans be used for dog?","0"
897,1795,1796,"What are the differences between Asia and Africa? What are the similarities?","What is difference between Cableway and Ropeway?","0"
898,1797,1798,"Has wizard magic been scientifically tested?","Have mages been scientifically tested?","1"
899,1799,1800,"Why is contract law important?","Why is maritime law so important?","0"
900,1801,1802,"When will moto G3 (Moto G 3rd gen 2015) get Android 7.0 (Nougat) update?","How long will I get OS updates on moto g3?","0"
901,1803,1804,"Prove that SNR of power = (SNR of voltage) sequare?","Do you get paid when you do fight companions on the JRE or is it just for fun/exposure?","0"
902,1805,1806,"What are the best riddles by the Riddler (Batman)?","Who was the best villain in the Nolan Batman films?","0"
903,1807,1808,"Why there is so much nudity content in Game of Thrones?","Why is there so much nudity in the Game of Thrones TV Series?","1"
904,1809,1810,"How can I get followers and comments on my blog?","How can i get more follower on my blog?","1"
905,1811,1812,"I have only 2 months for my CA CPT exams how do I prepare?","I want to crack CA CPT in 2 months. How should I study?","1"
906,1813,1814,"What programming language should I learn if I want to do a 2D MMORPG game?","Which programming language should I learn if I want to develop gaming apps?","1"
907,1815,1816,"What is your view on the recent demonetization in India?","What are your views on demonetization of ₹500 & ₹1000 notes in India?","1"
908,1817,1818,"Why was cyrus mistry removed?","Why TATA sons replaced Cyrus Mistry to Ratan TATA?","1"
909,1819,1820,"How do you cancel USAA auto insurance?","Auto insurance Broker fee in CALIFORNIA?","0"
910,1821,1822,"Why have I been so angry lately?","Why am I so angry?","0"
911,1823,1824,"How do you form a hypothesis, since you haven't done any testing and don't have any test results yet?","Why do people who have done master's degrees in any field advise you not to do a master's?","0"
912,1825,1826,"What are the consequences of trolling?","What are some consequences of blackouts?","0"
913,1827,1828,"I am frightened of Arvind kejriwal, he may kill me, What shall I do?","What is the risk of selling bitcoin and accepting credit card payment?","0"
914,1829,1830,"What disadvantages do Apple computers/laptops have over other brands?","Why do so many people in the US have an Apple-branded phone or laptop?","0"
915,1831,1832,"What is the first moment you remember in your Life?","What is the very first thing you remember in your life?","1"
916,1833,1834,"What can I do after completing BDS?","What can we do after completing BDs?","1"
917,1835,1836,"Does all Muslims hate Narendra Modi?","Why Muslims hate Modi government?","1"
918,1837,1838,"I'm 18. What should I do?","What can I do when I'm 18?","1"
919,1839,1840,"What are some really good and famous romantic comedy movies?","What are the best romantic comedy movies?","1"
