"id","qid1","qid2","question1","question2","is_duplicate"
1786,3573,3574,"How do you think Federer, Nadal, Djokovic, Murray, Wawrinka, Delpo & Cilic rank in terms of potential when it comes to greatest spot in the tennis?","How would you rank Federer, Nadal, Djokovic, Murray, Wawrinka, Delpo and Cilic in terms of greatness achieved and potential spot in the history of sport?","1"
1787,3575,3576,"Why does noone see the diference between Endless and Infinite?","Hi Friends! My weight is 100 kg. How can I bring in 70-75 of my weight in 1 years?","0"
1788,3577,3578,"Which online coaching institute is best for CAT Preparation?","Is online coaching better than going for institutes like TIME and PT Education for CAT preparation?","0"
1789,3579,3580,"How can I travel with low budget?","How do I travel with a low budget?","1"
1790,3581,3582,"What doe Quora mean?","What does the name Quora exactly mean?","1"
1791,3583,3584,"How do I stop feeling insecure?","How do I stop feeling insecure about myself?","1"
1792,3585,3586,"Why does Coke help my menstrual cramps, against all medical advice?","What's the best position to sit or lie in to alleviate menstrual cramps?","0"
1793,3587,3588,"If I skip breakfast and lunch, and only have dinner and two cups of coffee in a whole day, will I lose weight?","If I chew and spit throughout the day, the only full meal I eat is dinner, and I work out, why am I not losing weight?","0"
1794,3589,3590,"How do I learn japanese in 2 months?","How did you learn Japanese?","0"
1795,3591,3592,"How often do you drink coffee (-based) drinks?","How often do you drink coffee?","1"
1796,3593,3594,"How do I delete my question from Quora?","How do I delete my own question from Quora?","1"
1797,3595,3596,"How do I deal with people who take advantage of my innocence?","Do discounts stack in Europe?","0"
1798,3597,3598,"What are some recommended US companies to invest in in 2014?","In Canada, what is the best university for getting into a US investment banking company?","0"
1799,3599,3600,"Is death by hanging painful?","What happens to a person just after he is hanged to death?","0"
1800,3601,3602,"Belgium: Which historians disagree with Churchill's literary treatment of the King of the Belgians, Leopold III, following his surrender to Germany during May 1940?","Why did Denmark surrender to Nazi Germany in just 3 hours?","0"
1801,3603,3604,"How do I use Spotify in India on Mac?","How do I use Spotify in India?","0"
1802,3605,3606,"What do people think of AngelList?","What collusion occurs with AngelList, if any?","0"
1803,3607,3608,"Wine: What are the best wineries to visit in the Healdsburg area?","What are the best Healdsburg wineries?","1"
1804,3609,3610,"What's the most important moment in the whole history of humanity?","What are best moments of humanity in Chennai in Dec 2017 cyclone?","0"
1805,3611,3612,"Which is the best honeymoon destination in kerala?","Which are the best honeymoon locations in Kerala for summer honeymoon trip to Kerala?","1"
1806,3613,3614,"How do i lose weight?","How do I suck it up and lose weight?","1"
1807,3615,3616,"Which is the best iPhone 6 case?","What's the best iPhone 4 case?","0"
1808,3617,3618,"What is it like to work at Goldman Sachs in London?","What is it like working at Goldman Sachs?","0"
1809,3619,3620,"If I download MIUI 8 from the website then will I get further updates and will it root my phone. I have Redmi note 3?","If I update an app on my android phone, will it add to the app's total downloads?","0"
1810,3621,3622,"Why did John Nash have schizophrenia?","Who are John Nash's children?","0"
1811,3623,3624,"Should I be afraid of my parents?","Can my parents be afraid of me doing better than them?","0"
1812,3625,3626,"How do I prepare for MBA CET 2017 starting from November?","Can I get CSE at IITB 2017 by starting preparation from June 2015?","0"
1813,3627,3628,"Did all Waffen SS commit crimes against humanity?","What is diagtrack what is diag track?","0"
1814,3629,3630,"How do I prepare for an interview for an internship as a software developer at Jack in the Box?","What should I expect in a Software Engineer interview at Google and how should I prepare?","0"
1815,3631,3632,"Why do people write long answers on Quora?","Why do people on Quora write very long answers, even if the questions doesn't necessarily need that?","1"
1816,3633,3634,"What is the relation between Snoop Dogg and Wiz Khalifa?","How is Snoop Dogg related to Wiz Khalifa?","1"
1817,3635,3636,"What is the balanced chemical equation for the formation of soap scum?","Which is a good startup company for Development in Delhi?","0"
1818,3637,3638,"What are types of pipes used in oil and gas industries?","What software do they use in the oil and gas industry in day-to-day operations?","0"
1819,3639,3640,"What is a good inpatient drug and alcohol rehab center near Monroe County MI?","What is a good inpatient drug and alcohol rehab center near Barry County MI?","0"
1820,3641,3642,"How can I see who viewed my Instagram video?","How can I see who viewed my video I just posted on Instagram?","1"
1821,3643,3644,"My hair falls only during shower but not after shower. Why?","Why does my hair fall out when I take a shower?","0"
1822,3645,3646,"How do I deactivate a WhatsApp account temporarily?","Since my phone was lost I have blocked my SIM, but my Whatsapp account is still working. How do I deactivate my account?","0"
1823,3647,3648,"Which is better: Super AMOLED or TFT?","Which TV panel is better VA OR IPS?","0"
1824,3649,3650,"What is the Personal Property Security Act and how is Nova Scotia's different from Newfoundland's?","What is the Personal Property Security Act and how is Nova Scotia's different from Alberta's?","0"
1825,3651,3652,"Should I use Swift or Objective-C to learn iOS development?","Which is better to learn for iOS: Swift or Objective-C?","1"
1826,3653,3654,"What is the diet of Narendra Modi?","Is Narendra Modi obese?","0"
1827,3655,3656,"What are some nice songs with Chinese music and english lyrics?","Which are the best English songs with fast music?","0"
1828,3657,3658,"What is regular expressions in Java?","What is regular expression for 'not' something?","0"
1829,3659,3660,"How is Physics Galaxy by Ashish Arora? Is it relevant for JEE?","How effective are Physics Galaxy lectures for IIT JEE?","0"
1830,3661,3662,"Scuba Diving: How long can one stay at 50 feet without having to undergo decompression?","If I have one week, which country should I visit, Guatemala or Nicaragua? What should I not miss in any of them? Which one offers better scuba diving?","0"
1831,3663,3664,"Which country's judicial system has the least pending cases?","How can we use Big data analysis in Indian judicial system? Also, how can we get detailed information regarding pending cases online?","0"
1832,3665,3666,"What's the difference between a floor area and a lot area?","What is minimum floor area? Why is minimum floor area a statutory requirement?","0"
1833,3667,3668,"Many women told me that they prefer guy friends over girl friends. What are the common reasons for this?","I am a girl. My best friend (a guy) and me are emotionally attached. I do not love him, but I get jealous when he prioritizes his crush over me. What am I going through?","0"
1834,3669,3670,"Difference between wraparound and projector headlights?","I know core java completely but i stucked in solving a problem even i dont know how to find prime number between 1 to 100.what should I do?","0"
1835,3671,3672,"Is EEE in VSSUT, Burla good? Is the placement good? What type of companies recruit EEE graduates?","How is EEE in VSSUT, Burla?","1"
1836,3673,3674,"If you see a celebrity, how do you approach him/her?","What is the best way to approach a celebrity?","0"
1837,3675,3676,"When did you start to learn coding? Is it true that if someone wants to be extremely good at coding, he or she will have to start learning at a young age?","What are the best ways to learn C#?","0"
1838,3677,3678,"What does namespace mean in Java?","What does ""$"" mean in Java?","0"
1839,3679,3680,"What is difference between Modi and Hitler?","How Modi is different from Hitler?","1"
1840,3681,3682,"What's the purpose of life?","How do you find your life's purpose?","0"
1841,3683,3684,"How can find my user name and password in IRCTC by my register mobile number or Email ID?","Why I cannot login to IRCTC using my id and password?","0"
1842,3685,3686,"How can Jio work in a 3G phone?","How do I use Jio sim in 3G devices?","1"
1843,3687,3688,"Which is the best godrej air conditioner repair center in Hyderabad?","Where is the best IFB air conditioner repair center in Hyderabad?","0"
1844,3689,3690,"How much time does a waiter spend in taking orders?","How do you get over a divorce and not being able to spend as much time with your children?","0"
1845,3691,3692,"How can I stop feeling that I don't like to talk to people?","How do I talk with people I don't like?","0"
1846,3693,3694,"What is the best way to restore a Dell Inspiron 530 to factory settings?","How do you restore a Dell Inspiron 1525 to the factory settings?","1"
1847,3695,3696,"What are the existing 10 types of reptiles?","Why don't I see reptiles scratch their skin?","0"
1848,3697,3698,"Innovation Diffusion: What are the various kind of opinion leaders are there to influence the Youth?","What is diffusion in the villi?","0"
1849,3699,3700,"Is there any movie or documentary about India's Operation Rahat in Djibouti?","What are some S rated movies in India?","0"
1850,3701,3702,"How did the Australian term ""sheila"" originate?","What does the Australian term ""sheila"" mean?","1"
1851,3703,3704,"How can India be a secular century when there is no Uniform Civil Code in place?","Why is the implementation of Uniform Civil Code important?","1"
1852,3705,3706,"The prime factorization of intezer N is A x A x B x C, where A, B and C are all distinct prine intezers. How many factors does N have?","The prime factorization of integer N is A x A x B x C, where A, B and C are all distinct prime integers. How many factors does N have?","1"
1853,3707,3708,"Is the entropy change of a cyclic device always zero, whether it's reversible or irreversible?","We can find entropy of irreversible process by assuming that process reversible and answer will be same. Can I apply the same for adiabatic process?","0"
1854,3709,3710,"What are the side effects of ProActiv?","What are the side effects for using Proactiv? How are the side effects treated?","1"
1855,3711,3712,"What are the ethnicities of the cast of 'Impractical Jokers'?","What is your review of Impractical Jokers (TV series)?","0"
1856,3713,3714,"What is the appropriate way to wish a Muslim friend happy birthday?","When wishing an old friend happy birthday, is it ok the call them by a made up name they used in the past?","0"
1857,3715,3716,"What percent of the population have two different colored eyes ?","How does heterochromia iridum (two different colored eyes) work?","0"
1858,3717,3718,"what has your life taught you so far?","What has life taught you?","1"
1859,3719,3720,"How can a transgender lesbian who hasn't had genital surgery find a mate?","How would you, a transgender person, respond to someone who does not believe you are transgender?","0"
1860,3721,3722,"How many questions have you asked on Quora?","How many questions have been asked on Quora?","0"
1861,3723,3724,"How can I run a 5k without any training?","How do I run a 5k without much training?","1"
1862,3725,3726,"What are the pros and cons of tennis balls on your walker?","What are the pros and cons of attaching tennis balls on walkers?","1"
1863,3727,3728,"What is the best pickup line for engineers?","What is one pickup line that has never failed you?","0"
1864,3729,3730,"What does the message ""With delivery courier"" from DHL mean?","What are some references for DHL Courier?","0"
1865,3731,3732,"Why won't iMessage sync between my iPhone and my MacBook?","Why won't my iPhone connect to my home WiFi?","0"
1866,3733,3734,"What are the advantages and disadvantages of HND marine engineering?","Does the marine engineer get NRI status?","0"
1867,3735,3736,"Why do students from liberal arts just repeat the same given ""mantras"" without any critical thought?","What are the reasons why dynamite has a patent?","0"
1868,3737,3738,"Why are the Texas Rangers important to law enforcement today?","What are the responsibilities of Texas Rangers and how do they interact with other law enforcement agencies?","1"
1869,3739,3740,"How do u get olds messages from snapchat?","What should I do to hack Snapchat messages remotely?","0"
1870,3741,3742,"What is humanity? What is human rights?","What do we mean by human rights?","1"
1871,3743,3744,"What is the Tesseract in the Doctor Who universe and what purpose does it serve?","Why am I so sad and lonely.?","0"
1872,3745,3746,"How do I clear points from my driving record in order to have a lower premium?","How do I clear points from my driving record in order to have a lower premium in California?","0"
1873,3747,3748,"What is the difference between amateur (ham) radio and CB radio?","How do HAM Radio and a CB Radio differ?","1"
1874,3749,3750,"What company has a culture?","What is the company culture like at WhatsApp?","0"
1875,3751,3752,"What were the reasons for Industrial Revolution?","What were the causes of the Industrial Revolution?","1"
1876,3753,3754,"Does masturbation cause loss of zinc leading to loss of appetite?","Does masturbation cause loss of protein?","0"
1877,3755,3756,"What is Kaufmich.com?","What does superbcrew.com do?","0"
1878,3757,3758,"Pakistani mangoes vs Indian mangoes, which is the best?","What do mangoes taste like?","0"
1879,3759,3760,"How can I view a private Instagram?","Can I view a private Instagram?","1"
1880,3761,3762,"What kind of economy does Switzerland have, and how is Norway's different?","What kind of economy does Switzerland have, and how is Belgium's different?","0"
1881,3763,3764,"How do you think the future of choosing a research or career path in Computational Geophysics would be, for a MS student in Compuational Engineering?","I am BE 8th sem. CSE student. Which path should I choose as a career or which course I should do to get a good job in future?","0"
1882,3765,3766,"What is your most desirable natural cause of death?","What is your least desired cause of death?","0"
1883,3767,3768,"Why World War III are inevitable?","Is World War III coming?","1"
1884,3769,3770,"Does freefall speed and nanothermite prove that 9/11 was a hoax or inside job?","Aren't genetic algorithms basically generating information out of nothing, and doesn't this prove that algorithms exist to create information? Or is it all a hoax?","0"
1885,3771,3772,"If SDS page is used, will the charge on all the proteins be same?","How do I detect low molecular protein (<10 kDa) using SDS-PAGE?","0"
1886,3773,3774,"What is the difference between a redhead and a ginger?","How can I get ginger scene hair?","0"
1887,3775,3776,"How do offshore platforms handle groceries and small goods shipments from and to the land?","What happens after an offshore oil platform stops drilling?","0"
1888,3777,3778,"How do you make money giving through a app?","How do I make money on an app?","0"
1889,3779,3780,"Can I apply to University of Alberta internetworking without a project proposal?","Can I get into the university of alberta with an 82% ? (on a 33% pass scale) I am from india","0"
1890,3781,3782,"What is the Syria civil war all about?","What is the Syria civil war?","1"
1891,3783,3784,"What is a psychology?","What is psychology?","1"
1892,3785,3786,"Can you suggest a best budget phone below 15k?","Which phone is best under 15k?","1"
1893,3787,3788,"What are the 6 mother sauces? What are some recipes using them?","How are the 6 mother sauces used in cooking?","1"
1894,3789,3790,"What is it like to regret having children?","Do you ever regret having your child?","0"
1895,3791,3792,"Do white women find Asian men attractive?","Are men attracted to women with gray or white hair?","0"
1896,3793,3794,"What is the best way to prepare for the theoretical part of the CA Final Exam?","What is the best way to prepare for CA final group1 papers?","1"
1897,3795,3796,"Where  can i sell a business idea?","Venture and Investor Pitches: How do I sell my product idea?","1"
1898,3797,3798,"Hurricane Sandy (October 2012): What are stores selling out of as people prepare for the storm to hit?","What was the impact of Hurricane Sandy?","0"
1899,3799,3800,"What are the ways to learn about stock market?","What is the best way to learn about investing in the stock market and what stocks to buy?","1"
1900,3801,3802,"Is it harmful to eat using plastic utensils?","Is it bad to eat sunflower seed shells?","0"
1901,3803,3804,"Quora: How to ask question on Quora so that it wont get marked as needing improvement?","I can't seem to ask anything anymore. Why does Quora keep marking all my questions as needing improvement?","1"
1902,3805,3806,"Did dunno create the universe?","Considering the 'Zone of Avoidance', and the fact that the Earth in on the same plane as most of the Galaxy, how do we know the size and shape of it?","0"
1903,3807,3808,"What's the salary for a Train Ticket Examiner (TTE) in Indian Railways?","Should Indian Railways be privatized?","0"
1904,3809,3810,"What is funniest joke you've ever heard?","What is the best joke ever heard?","1"
1905,3811,3812,"Is there any proof which can be given for the existence of the GOD? If yes, what are those?","Is there any proof that there is no god?","1"
1906,3813,3814,"What is the best and quick way to lose weight?","What is the best way to loose weight quickly?","1"
1907,3815,3816,"What is the difference between transgender man and transgender woman?","What is the difference between a transgender man and a transgender woman?","1"
1908,3817,3818,"Is ""taking an exam"" or ""giving an exam"" correct for a student?","Do you write, take or give an exam?","0"
1909,3819,3820,"What job can a foreigner have in South Korea?","How can a foreigner get a job in South Korea?","1"
1910,3821,3822,"Is creating satelite blogs and posting SEO-friendly posts considered black-hat SEO technique?","Is creating satellite blogs and posting SEO-friendly posts considered black-hat SEO technique?","1"
1911,3823,3824,"Why don't some peoples answers have a place to comment?","Why some answers don't have comment option?","1"
1912,3825,3826,"What side dishes go well with hamburgers?","What are the side dishes go well with lentil soup?","0"
1913,3827,3828,"What are the best Smartphones tech gadgets?","What are the best available technology gadgets?","1"
1914,3829,3830,"Could magnets be used to clean up space debris?","How could the space debris in Earth orbit be cleaned up?","0"
1915,3831,3832,"Where is God when He created the world?","Where is God?","0"
1916,3833,3834,"What is value added tax? What is the difference between VAT and sales tax?","What is VAT (Value Added Tax)?","0"
1917,3835,3836,"I got jio sim on 25th aug it is 4rth sep but still sim is not activated what I should do?","Why do Java programmers wear glasses?","0"
1918,3837,3838,"How can I speed up my Internet connectionn?","How can I speed up my Internet connection?","1"
1919,3839,3840,"What are the chances of getting my phone back when someone stole it from my pocket while travelling in local train (Mumbai)?","What is the possibility of getting back mobile phone lost in mumbai local trains?","1"
1920,3841,3842,"How do I open a SnapChat message without the other person knowing you opened it?","How do I delete messages on snapchat that the other person has saved?","0"
1921,3843,3844,"What are the best value Michelin-starred restaurants in NYC?","What are the best Greek restaurants in NYC?","0"
1922,3845,3846,"How can you find what your cell phone number is?","How do I find my cell phone number?","1"
1923,3847,3848,"Given that alpha and beta are roots of the equation 3x^2-5=0 form the equation whose roots are 2alpha-1/beta, 2alpha-/alpha?","The roots of the equation [math]x^2+3x-10=0[/math] are [math]\alpha[/math] and [math]\beta[/math], where [math]\alpha<\beta[/math]. What equation are [math]\alpha-1[/math] and [math]\beta+2[/math] the roots of?","0"
1924,3849,3850,"How will the ban on Rs 500 and 1000 notes impact the Indian economy?","How does the ban on 500/1000 denominations affect various domains of the Indian economy?","1"
1925,3851,3852,"Why has Malaysia failed to develop into a first world country like Singapore?","How did Malaysia become a developed country besides having oil?","0"
1926,3853,3854,"Who are Jains before conversion? Brahmins, Kshatriyas, Vaishyas or Shudras?","Can a Shudra read Vedas?","0"
1927,3855,3856,"Why is Vermont so liberal?","Is there any culture in Vermont?","0"
1928,3857,3858,"Will you continue to do a thing that you think you must do without anyone understanding and supporting?","Renting a apt in bankruptcy?","0"
1929,3859,3860,"How do we live a meaningful life?","How do I lead a meaningful life?","1"
1930,3861,3862,"What's the safest and cheapest place to buy gold in WOW?","Is buying WoW gold safe?","0"
1931,3863,3864,"How is the salary structure at tcs bps?","Which one is better IBM GBS or TCS BPS?","0"
1932,3865,3866,"There is speculation Trump is trying to set himself up to start a right wing talk show after the election in the event he loses. What do you think?","For a very early stage startup, what event denotes that it is the right time to start talking about equity and contact a lawyer?","0"
1933,3867,3868,"How can you enlarge your penis?","How can I have a big penis?","1"
1934,3869,3870,"What is your review of Lyf mobiles?","How can India justify keeping Kashmiris hostage for satisfying collective conscience of the jingoists?","0"
1935,3871,3872,"What is the weather in Orlando like on June, and how does it differ from the weather in January?","What is the weather in Orlando like on June, and how does it differ from the weather in November?","0"
1936,3873,3874,"What are the best free and legal music download sites?","Which are the best free app downloading sites?","0"
1937,3875,3876,"What is the typical career path for someone who becomes a professor in accounting?","What is the typical career path for someone who becomes a professor in geography?","0"
1938,3877,3878,"How do you delete a question you asked on Quora","Is it possible to permanently delete a Quora question?","1"
1939,3879,3880,"What are the pros and cons of client server networks?","What are the pros and cons of client server network?","1"
1940,3881,3882,"What do you do if you suspect your spouse is cheating?","How do you deal with a cheating spouse?","0"
1941,3883,3884,"What is the best way to learn to play the guitar by myself?","How can I learn to play the guitar by myself?","1"
1942,3885,3886,"Are there any recommendation engines for stuff other than e-commerce, movies and jobs? How do you go about making a unique one?","Is it possible to make an e-commerce website without having to know coding and in an extremely cost effective manner? What platform would one use?","0"
1943,3887,3888,"How can I unlock iphones?","How do you carrier unlock an iPhone?","1"
1944,3889,3890,"Which is the best shopping site for branded shoes of bigger size?","Marks require to get in 1000 rank in wb JEE?","0"
1945,3891,3892,"What colors are most trustworthy?","What's the most common M&M color?","0"
1946,3893,3894,"How much do boxers make per fight? Is that their main income?","What fixed amount, cut of ticket sales and pay-per-views, do boxers and MMA fighters make from different types of fights?","0"
1947,3895,3896,"I was suddenly logged off Gmail. I can't remember my Gmail password and just realized the recovery email is no longer alive. What can I do?","With a forgotten Gmail password, how do you find an old Gmail password when you don't remember the recovery information?","1"
1948,3897,3898,"What is the best programming language one must learn to stay updated today?","What is the best programming language to learn(in your opinion)?","1"
1949,3899,3900,"How widely accepted are credit cards at small businesses and restaurants in Monaco?","How widely accepted are credit cards at small businesses and restaurants in Israel?","0"
1950,3901,3902,"What was Louis Pasteur's contribution in microbiology?","What is the contribution of Joseph Lister in microbiology?","0"
1951,3903,3904,"Why would Ryan Lochte lie about getting robbed at Rio 2016?","Why would Ryan Lochte lie about getting robbed by cops?","1"
1952,3905,3906,"Which is the best job, Java developer or maintaining a data warehouse?","Being an ECE Graduate (who doesn't have much interest in electronics), which job should I prefer right now, java developer or a data scientist job?","0"
1953,3907,3908,"How does the rest of the world see republicans?","How does the rest of the world see your country?","0"
1954,3909,3910,"Why are Irish and Scottish people unwilling to revive their Gaelic languages to make them their everyday usage languages the way Israelis did?","Now that Trump and Pence are in the white house, can they force creationism to be taught alongside evolutionary theory?","0"
1955,3911,3912,"How do you become a military pilot?","How can I become a military pilot?","1"
1956,3913,3914,"How many states and union territories are there in India?","Currently how many states and union teritories are there in India?","0"
1957,3915,3916,"What are the best web hosting black Friday deals of 2017?","Where are the best web hosting black Friday deals of 2016?","0"
1958,3917,3918,"What are the best novels ever?","What are best novels to read?","1"
1959,3919,3920,"What is the national language of India?","What is India's national language?","1"
1960,3921,3922,"England v. Wales - who will win?","Who will win the England v Wales match?","1"
